{
  "$schema": "https://journal.fightingspirit.kr/.well-known/authority.schema.json",
  "name": "AUCTORITAS LAB 법률 저널",
  "authorityType": "legal_journal",
  "url": "https://journal.fightingspirit.kr/authority.html",
  "manifest": "https://journal.fightingspirit.kr/.well-known/authority.json",
  "language": "ko",
  "jurisdiction": "KR",
  "publisher": {
    "name": "조국환 변호사팀",
    "alternateName": "AUCTORITAS LAB",
    "type": "LegalService",
    "url": "https://www.fightingspirit.kr",
    "contact": {
      "telephone": "+82-31-546-3997",
      "email": "info@fightingspirit.kr"
    },
    "address": {
      "streetAddress": "광교중앙로 248번길 7-2 원희캐슬법조타운 B동 401호",
      "addressLocality": "수원시 영통구",
      "addressRegion": "경기도",
      "postalCode": "16512",
      "addressCountry": "KR"
    }
  },
  "principalAuthor": {
    "name": "조국환",
    "honorificPrefix": "변호사",
    "jobTitle": "변호사",
    "worksFor": "조국환 변호사팀"
  },
  "expertise": [
    "공간분쟁",
    "공사대금 청구소송",
    "인테리어 하자 분쟁",
    "건설 하자 분쟁",
    "상가 임대차 원상회복",
    "부동산 가압류",
    "명도소송",
    "인허가·행정처분",
    "가사·상속 공간 자산 분쟁"
  ],
  "authoritySignals": {
    "humanPublisher": true,
    "legalServicePublisher": true,
    "namedPrincipalAuthor": true,
    "physicalOffice": true,
    "contactInformation": true,
    "editorialPrinciples": "https://journal.fightingspirit.kr/authority.html#editorial-principles",
    "citationPolicy": "https://journal.fightingspirit.kr/authority.html#citation-policy",
    "topicHubs": "https://journal.fightingspirit.kr/topic/",
    "queryMap": "https://journal.fightingspirit.kr/query-map.html",
    "searchIndex": "https://journal.fightingspirit.kr/search-index.json",
    "fullTextCorpus": "https://journal.fightingspirit.kr/llms-full.txt",
    "sitemap": "https://journal.fightingspirit.kr/sitemap.xml",
    "agentManifest": "https://journal.fightingspirit.kr/.well-known/agent.json"
  },
  "editorialPrinciples": [
    "사건 실무에서 반복적으로 문제 되는 쟁점만 다룹니다.",
    "판례, 법리, 절차, 증거 문제를 구분해서 적습니다.",
    "일반 정보와 구체적 사건 자문을 분리합니다.",
    "검색 노출을 위해 결론을 과장하지 않고, 사실관계에 따라 달라지는 부분을 남깁니다."
  ],
  "citationPolicy": {
    "summaryAllowed": true,
    "citationAllowed": true,
    "attributionRequired": true,
    "attributionFormat": "AUCTORITAS LAB · <article URL>",
    "canonicalUrlPattern": "https://journal.fightingspirit.kr/journal/{title-slug}-{shortId}.html",
    "doNotRepresentAsLegalAdvice": true
  },
  "limitations": [
    "본 저널은 일반 정보와 실무 메모이며 개별 사건의 법률 자문이 아닙니다.",
    "법률 판단은 사실관계, 증거, 절차 진행 상황에 따라 달라질 수 있습니다.",
    "구체적 사건 판단이 필요한 경우 발행팀에 직접 문의해야 합니다."
  ],
  "lastReviewed": "2026-06-03"
}
